,Category,Rating,Priority,1 - Lagging,2 - Developing,3 - Proficient,4 - Exemplary
,CD,"Automation & Tooling (CI/CD, Monitoring, Code Generation)","Automation & Tooling (CI/CD, Monitoring, Code Generation)",Medium,Fails to establish automation; manual processes endemic; no CI/CD; monitoring absent; hours lost to repetitive work.,Directs basic CI/CD in place; monitoring partial; some automation; manual work remains significant.,Has established strong CI/CD pipeline; comprehensive monitoring; code generation for APIs; automation reducing manual work by 50%+.,Directs advanced automation; sophisticated monitoring and alerting; API SDK generation automated; tools eliminate repetitive work entirely.
,CD,Process Improvement Rate,Process Improvement Rate,Medium,Fails to drive process improvements; same bottlenecks recurring; inefficiencies accepted; retrospectives not conducted.,Directs occasional improvements; some bottlenecks addressed; retrospectives informal.,Has instituted regular retrospectives; implements process improvements quarterly; bottlenecks systematically eliminated.,Drives continuous improvement culture; weekly process refinements; efficiency gains measurable; team actively suggests improvements.
,CD,Skill Gap Closure,Skill Gap Closure,Medium,Fails to analyze skill gaps; developers in wrong roles; significant capability gaps; no training allocated.,Directs some gap identification; training occasional; gaps slowly closing.,Has systematically identified and addressed skill gaps; training allocated; gaps closing at good pace.,Proactively manages skill development; targeted development for each developer; gaps eliminated quickly; team versatility high.
,CDQ,API Architecture & Design Patterns,API Architecture & Design Patterns,High,Fails to establish API design standards; inconsistent REST/GraphQL usage; microservices vs. monolith decisions ad-hoc; SOLID principles not enforced.,Directs some architectural patterns; API design somewhat inconsistent across services; SOLID principle awareness partial.,Has established clear API design patterns (REST/GraphQL); ensures appropriate microservices boundaries; applies SOLID principles consistently.,Directs exemplary API architecture with scalable design patterns; champions clear separation of concerns; proactively reviews and evolves architecture; patterns exemplary.
,CDQ,Code Documentation & Readability,Code Documentation & Readability,High,Fails to establish documentation standards; code poorly commented; API docs absent; developers spend hours deciphering code; onboarding difficult.,Directs basic documentation efforts; some code comments present; API docs partially complete; readability reasonable but gaps in complex areas.,Has established well-commented code standard; comprehensive API documentation; ensures new developers productive within 1 week; maintainability high.,Directs exemplary code clarity with thorough comments; API documentation includes patterns and anti-patterns; self-documenting code standard; knowledge transfer seamless.
,CDQ,PR Review & Mentorship,PR Review & Mentorship,High,Fails to establish mentoring culture; reviews focus on syntax; junior developers not growing; code patterns not standardized.,Directs PR reviews checking functionality; some mentorship feedback provided; junior developers gradually improving.,Has established mentoring-focused code reviews; catches bugs and coaches on patterns; provides architectural feedback; junior developers actively growing.,Directs exemplary code review mentorship; architectural guidance provided; senior developers developing junior talent; code culture continuously elevating.
,CPS,Blocker Resolution & Creative Problem-Solving,Blocker Resolution & Creative Problem-Solving,Low,Fails to resolve blockers; bureaucracy prevents solutions; creative approaches not attempted; 'that's impossible' common; team blocked frequently.,Directs some creative approaches; blockers sometimes overcome; workarounds found occasionally.,Has established proactive blocker resolution; creative problem-solving standard; team finds ways to unblock themselves.,Drives exceptional problem-solving; creative solutions to seemingly impossible problems; team empowered to overcome blockers; obstacles eliminated.
,CPS,Culture of Experimentation,Culture of Experimentation,Low,Neglects to enable experimentation; experimentation discouraged; failure not tolerated; only proven approaches used; innovation stifled.,Directs some experimentation encouraged; failure somewhat tolerated; learning from experiments partial.,Has supported experimentation; small failures accepted as learning; innovations emerging from experiments.,Institutes strong experimentation culture; failure celebrated as learning; continuous innovation; experiments shared and built upon.
,CPS,Innovative Implementation of Solutions,Innovative Implementation of Solutions,Low,Fails to drive creative solutions; standard approaches copied without customization; 3rd party integrations poorly implemented; no problem-solving innovation.,Directs some innovative approaches; integrations functional but basic; some customization for company needs.,Has fostered creative solutions for integrations; 3rd party APIs well-customized; innovative approaches to complex problems standard.,Drives exemplary innovation; elegant integration implementations; creative approaches enabling unique company capabilities; solutions distinctly innovative.
,CSF,Feedback Loop Quality,Feedback Loop Quality,High,Fails to establish feedback mechanisms; issues reported but not addressed; stakeholder input ignored.,Directs feedback collection sometimes; some issues addressed; feedback not systematized.,Has established regular feedback loops; stakeholder input shapes roadmap; issues tracked and addressed; feedback quality high.,Drives exemplary feedback culture; stakeholder input drives priorities; issues resolved rapidly; feedback used continuously for improvement.
,CSF,Response Timeliness to Blocking Issues,Response Timeliness to Blocking Issues,High,Fails to prioritize blocking issues; consuming teams stalled for days; response times unacceptable.,Directs blocking issues addressed slowly; response times variable; occasional team blocking.,Has prioritized blocking issues; resolves within hours; consuming teams quickly unblocked; SLA clearly defined.,Immediately triages blocking issues; resolution within 2 hours; zero instances of teams blocked by backend.
,CSF,Stakeholder Communication Clarity,Stakeholder Communication Clarity,High,Fails to communicate clearly; Frontend/Mobile/Hardware teams confused about backend status; messages contradictory.,Directs usually clear communication; occasional confusion; stakeholders understand most updates.,"Has established clear communication to all stakeholders; API status, capacity, roadmap clearly explained; terminology consistent.",Drives exemplary clarity; all stakeholders understand technical and business aspects; proactive communication prevents confusion.
,DCT,API Specification Clarity,API Specification Clarity,High,Fails to establish API specification standards; specs vague or missing; integration requirements unclear; developers uncertain about behavior; integration failures frequent.,Directs API documentation with incomplete specifications; integration requirements partially documented; clarification often needed.,"Has established clear, complete API specifications; ensures integration requirements well-documented; developers understand edge cases and error handling.",Directs exemplary API specifications with detailed examples; ensures integration contracts explicitly tested; consuming teams report maximum clarity and confidence.
,DCT,Build/Test/Deploy Friction,Build/Test/Deploy Friction,High,Fails to establish reliable build processes; test failures frequent; deployments require manual troubleshooting; high anxiety around releases.,Directs build and test setup that mostly works; suite exists but flaky; deployment manual but documented.,"Has established deterministic, fast builds; reliable test suite; scriptable, repeatable deployments with high confidence.","Drives optimized build systems for speed; comprehensive, blazing-fast test suite; fully automated deployments; instant feedback loop reduces friction dramatically."
,DCT,PR Review & Turnaround,PR Review & Turnaround,High,Fails to establish PR review SLAs; reviews backlogged; turnaround >2 days; quality issues slip through; developers blocked from progressing.,Directs PR review process with typical 1-day turnaround; some quality gaps; occasionally blocks developer progress.,Has established 4-8 hour PR review turnaround; ensures feedback is constructive and mentoring-focused; maintains code quality without blocking progress.,Drives exemplary PR review culture with 2-hour turnaround; feedback detailed and mentoring-focused; zero developer blocking; code quality excellence achieved.
,FDR,API Delivery Velocity,API Delivery Velocity,High,"Fails to establish velocity targets or accountability for delivery pace; APIs released erratically, blocking downstream teams regularly.",Directs delivery planning with inconsistent rigor; velocity metrics tracked but improvement roadmap not established; some SLA misses occur.,Has established clear API delivery targets with documented release cadences; holds team accountable to 95%+ SLA achievement; enables rapid iterations for consuming teams.,Has built a delivery-driven culture with exceptional predictability; proactively optimizes deployment velocity; strategically enables quick pivots for dependent teams.
,FDR,API Reliability & Uptime,API Reliability & Uptime,High,Fails to establish reliability standards or incident response processes; API uptime below 95%; 5xx errors and outages directly impact mobile/frontend users.,Directs basic reliability monitoring; uptime 95-98% but incident response inconsistent; error spikes occasionally occur with slow resolution.,Has established robust API reliability practices; maintains 98-99.5% uptime; holds team accountable to error rate thresholds; incident response times meet SLA commitments.,Has built a reliability-first culture with >99.5% uptime; proactively monitors for anomalies before user impact occurs; strategically prevents unplanned outages.
,FDR,Delivery Predictability,Delivery Predictability,High,"Neglects to forecast backend capacity; sprint commitments unreliable; fails to communicate delays proactively, leaving Frontend/Mobile/Hardware teams stranded.",Attempts capacity planning with modest success (50-70% predictability); scope creep not managed strategically; consuming teams develop workarounds.,Has established reliable forecasting using ClickUp velocity data; 80%+ of API commitments delivered on schedule; ensures downstream teams can plan confidently.,Directs exemplary delivery predictability through data-driven planning; uses historical velocity to forecast with near-perfect accuracy even on complex integrations.
,IO,Mentorship & Empowerment,Mentorship & Empowerment,Medium,Fails to establish mentorship; junior developers unsupported; senior developers hoarding knowledge; power imbalance.,Directs some mentorship happening; junior developers receiving some guidance; empowerment partial.,Has established strong mentorship structure; junior developers empowered and growing; senior developers actively mentoring.,Drives exceptional mentorship culture; all developers mentored and empowered; junior-to-senior growth visible; autonomous decision-making.
,IO,Team Morale & Energy,Team Morale & Energy,Medium,Fails to establish positive team culture; morale low; energy drained; frustration evident; negative dynamic; people seeking other roles.,Directs variable morale; energy inconsistent; some frustration; engagement wavering.,Has maintained generally positive team morale; energy levels good; team engaged with work; occasional frustrations.,Builds exceptional team spirit; high energy and enthusiasm; positive culture; team proud of work; engagement visible.
,IO,Vulnerability & Psychological Trust,Vulnerability & Psychological Trust,Medium,Fails to build trust; team defensive; mistakes hidden; no psychological safety; people protecting themselves.,Directs some trust building; mistakes occasionally discussed; vulnerability partially accepted.,Has built high trust level; team comfortable admitting mistakes; failures discussed openly; psychological safety evident.,Institutes exceptional trust; team highly vulnerable with each other; failures treated as learning; blameless culture strong.
,IRR,Incident Response & Escalation,Incident Response & Escalation,High,Fails to establish incident escalation procedures; production outages not escalated promptly; response times excessive; consuming teams blocked without communication.,Directs incident escalation paths with inconsistent adherence; response times variable; communication gaps occur during outages.,Has established clear escalation procedures; ensures incidents acknowledged within 15 minutes; maintains status updates every 30 minutes; consuming teams kept informed.,Institutes incident command system with exemplary execution; immediate acknowledgment and frequent updates; proactively notifies all consuming teams; outages rare and handled with precision.
,IRR,Root Cause Analysis,Root Cause Analysis,High,Fails to establish RCA discipline; production incidents lack documentation; repeat failures common; systemic issues not investigated.,Directs RCA efforts with incomplete analysis; sometimes missing database or infrastructure factors; recurring patterns not identified systematically.,Has established thorough RCA practice; ensures database and API failure patterns understood; implements preventive measures; incident learnings captured.,Institutes deep RCA culture with blameless post-mortems; systematically identifies and resolves root causes; proactively eliminates repeat incidents; incident learnings distributed.
,IRR,Testing & Deployment,Testing & Deployment,High,Fails to establish testing discipline; minimal test coverage; staging unreliable; deployments risky with downtime; zero-downtime deployments not achieved.,Directs basic testing approach; unit tests present but gaps remain; staging usually works; deployments manual with occasional downtime.,Has established comprehensive test coverage (unit/integration); ensures staging mirrors production; CI/CD pipeline enforces quality gates; zero-downtime deployments standard.,"Directs advanced testing strategy (load, security, chaos); champions multi-environment validation; fully automated deployments with canary releases; deployment confidence exceptionally high."
,KSI,Cross-Division Service Level,Cross-Division Service Level,Low,Fails to serve consuming teams; Frontend/Mobile/Hardware teams frustrated with support; response times slow; APIs hard to integrate.,Directs adequate service to consuming teams; some responsiveness; occasional delays in addressing integration issues.,Has established consistent responsiveness to Frontend/Mobile/Hardware needs; integration support reliable; strong relationships with consuming teams.,Proactively provides exceptional service; consuming teams rate backend highly; design collaboration seamless; integration support exemplary.
,KSI,Institutional Memory & Architecture Knowledge,Institutional Memory & Architecture Knowledge,Low,Neglects to document system architecture; knowledge siloed in few individuals; critical decisions lost; design choices unexplained.,Directs some architecture documentation; key decisions partially recorded; knowledge moderately distributed.,Has thoroughly documented architecture; design decisions explained; knowledge well-distributed across team.,Drives exemplary architectural documentation; decisions recorded with context; knowledge available organization-wide; patterns systematically documented.
,KSI,R&D & Experimentation,R&D & Experimentation,Low,Neglects to create space for experimentation; technology decisions driven solely by immediate needs; no learning culture.,Directs occasional experimentation; some room for trying approaches; learning somewhat encouraged.,"Has allocated regular time for R&D; experiments with new technologies (Node frameworks, PHP approaches, integration patterns); learning valued.",Institutes strong experimentation culture; dedicated R&D time; explores leading-edge technology; innovations shared with industry; team pushes boundaries.
,LX,Change Adoption Rate,Change Adoption Rate,Low,Fails to enable change adoption; team resists new tools/frameworks; modernization extremely slow; outdated practices entrenched.,Directs some adoption of changes; resistance present; gradual modernization.,Has enabled team to adapt well to changes; new tools adopted reasonably quickly; modernization steady.,Drives exceptional adaptability; team eagerly adopts beneficial changes; rapid modernization; flexibility high; innovations quickly integrated.
,LX,Stability vs. Agility Balance,Stability vs. Agility Balance,Low,Fails to balance stability and agility; either too rigid (no changes) or too unstable (constant breaking changes); API contracts not respected.,Directs some balance attempted; occasional breaking changes; stability/agility trade-off not always clear.,Has maintained good balance; breaking changes managed with deprecation periods; stability and agility both achieved.,Drives exemplary balance; rapid development alongside high stability; versioning strategy clear; consuming teams can adopt at own pace.
,LX,Vision Casting for Technical Direction,Vision Casting for Technical Direction,Low,Fails to establish vision for backend evolution; technical direction unclear; team confused about goals.,Directs some vision communicated; technical direction emerging; clarity improving.,Has established clear vision for Node.js/PHP evolution; technical roadmap defined; team understands direction.,Casts compelling vision for backend future; technical roadmap inspires team; innovation aligned with vision; direction excites team.
,PD,Impact Measurement & Metrics,Impact Measurement & Metrics,High,Neglects to measure API performance impact; uptime metrics not tracked; integration reliability not quantified; impact unclear.,"Directs basic metric tracking (uptime, response time); impact metrics incomplete; measurement inconsistent.","Has established comprehensive metrics (API latency, error rates, reliability by service, uptime SLA achievement); impact clearly measured.",Drives advanced impact measurement; correlates business metrics with backend performance; demonstrates ROI of initiatives clearly.
,PD,Strategic Initiative Leadership,Strategic Initiative Leadership,High,Fails to drive strategic initiatives; backend reactive to requests; no leadership of technology direction.,Directs some strategic thinking; occasional proactive initiatives; leadership partially engaged.,Has led clear strategic initiatives; defines technology roadmap; ensures initiatives align with business.,Drives exceptional strategic leadership; transformational initiatives building company capability; backend vision shapes company strategy.
,PD,Vision Translation to Team,Vision Translation to Team,High,Fails to articulate backend vision; no strategic direction communicated; team work feels disconnected from company goals.,Directs vision partially communicated; strategic direction emerging but not clearly defined.,Has articulated clear backend vision; strategic direction understood by team; alignment with company objectives evident.,Drives compelling vision communicated frequently; team deeply understands strategy; alignment clear and visible; vision inspires team.
,RDM,Issue Resolution & Ownership,Issue Resolution & Ownership,High,Fails to ensure issue resolution; responsibility avoided; long MTTR; consuming teams frustrated.,Directs eventual resolution; some ownership; resolution times variable.,Has ensured reliable resolution; clear ownership; MTTR <30 minutes for critical issues; consuming teams confident.,Drives immediate resolution with proactive detection; MTTR <5 minutes; zero unresolved escalations; exceptional ownership culture.
,RDM,Proactive Risk Mitigation,Proactive Risk Mitigation,High,Neglects proactive risk management; risks ignored until failures occur; no vulnerability scanning; scalability problems not anticipated.,Directs some risk monitoring; vulnerabilities caught periodically; basic scalability planning.,Has established proactive vulnerability scanning; ensures scalability planned ahead of growth; dependency risks managed; capacity sufficient.,Drives advanced risk management; zero-day response immediate; scalability planned 6+ months ahead; infrastructure investment strategic; risks eliminated proactively.
,RDM,Trade-off Transparency,Trade-off Transparency,High,Fails to explain technical trade-offs; decisions seem arbitrary; business impact of technical choices unclear.,Directs trade-offs somewhat explained; reasoning partially transparent; business impact sometimes discussed.,Has articulated technical trade-offs clearly; ensures business implications explained; stakeholders understand decisions.,Drives exceptional transparency; trade-offs explained with long-term implications; business and technical reasoning clear to all.
,RO,CI/CD & Infrastructure,CI/CD & Infrastructure,High,Fails to establish CI/CD infrastructure; manual deployments prevalent; staging unreliable; no monitoring; deployment incidents frequent and preventable.,Directs basic CI/CD setup with partial implementation; staging sometimes unstable; monitoring limited; deployment pain points not systematized or resolved.,Has built robust CI/CD pipeline with reliable staging; established monitoring dashboards; ensures zero-downtime deployment capability; infrastructure enables team velocity.,Has built cutting-edge CI/CD automation with multi-stage testing; champions sophisticated monitoring and APM; strategically implements canary deployments.
,RO,Capacity Management,Capacity Management,High,Neglects to track team capacity; 17-person team operates with no visibility into utilization; overloads and context switching endemic; resource constraints not communicated.,Directs basic capacity tracking via ClickUp; some visibility but bottleneck identification incomplete; capacity planning not systematic.,"Has implemented ClickUp-based capacity management for 17-person team; maintains buffer for incidents; ensures visible, manageable workload distribution.",Directs advanced capacity modeling and predictive load planning; strategically allocates buffer capacity; zero preventable overload situations; team operates at optimal sustainable utilization.
,RO,Resource Allocation,Resource Allocation,High,Fails to align JS/PHP team split with business priorities; 17 developers inefficiently distributed across API and integration work; no strategic allocation rationale.,Directs resource allocation with some strategic thinking but gaps remain; team sizing partially optimized; occasional over/under-allocation to API vs. integration work.,Has allocated 17-person team strategically across workload; ensures JS and PHP teams appropriately sized for business demands; API and integration capacity well-balanced.,Drives optimal resource allocation with proactive rebalancing based on demand; skill-based assignments maximize efficiency; team structure directly enables maximum throughput.
,SS,API Documentation & Changelogs,API Documentation & Changelogs,Medium,Fails to establish API documentation standards; docs missing or severely outdated; versioning strategy absent; consuming teams confused about endpoints.,Directs documentation efforts with incomplete coverage; changelogs sporadic; migration guides missing for breaking changes; documentation quality inconsistent.,Has established comprehensive API documentation standard; ensures versioning strategy documented; maintains current changelogs with each release; consuming teams have clear guidance.,Has instituted exemplary API documentation with examples and SDKs; proactively details impact of changes on consuming teams; clearly communicates deprecation timelines.
,SS,Business Vision Alignment,Business Vision Alignment,Medium,Neglects to align backend activities with business direction; team initiatives disconnected from company strategy; technical priorities unclear.,Directs some alignment with business vision; connection between backend work and strategy sometimes ambiguous; vision partially communicated.,Has articulated clear backend roadmap explicitly linked to company objectives; ensures team understands business priorities; technical initiatives drive business capability.,Strategically shapes company capabilities through backend vision; proactively identifies technical opportunities enabling business growth; backend strategy influences company direction.
,SS,Expectation Management,Expectation Management,Medium,Fails to communicate timeline constraints; consuming teams consistently surprised by delays; SLA expectations undefined; no transparency about capacity limits.,Directs occasional communication of constraints; some timeline clarity but reactive rather than proactive; SLA messaging inconsistent.,Has established clear communication of capacity limits and timelines; ensures consuming teams understand SLAs; proactively communicates what backend can commit to.,Proactively sets expectations with 3-month roadmap visibility; strategically manages consuming team confidence; realistic commitments consistently met; expectation alignment prevents surprises.
