,Category,Rating,Priority,1 - Lagging,2 - Developing,3 - Proficient,4 - Exemplary
,CSF,Internal Knowledge Sharing,High,Knowledge hoarded; integration details not documented; consuming teams struggle to integrate; no shared learning,Some documentation; knowledge sharing occasional; consuming teams gradually learn integrations,Regular knowledge sharing sessions; integration documentation comprehensive; consuming teams quickly productive,Exceptional knowledge distribution; proactive teaching; consuming teams highly capable; shared learning culture
,CSF,Feedback Loop Quality,High,No feedback mechanism; issues reported but not addressed; stakeholder input ignored,Feedback collected sometimes; some issues addressed; feedback not systematized,Regular feedback loops; stakeholder input shapes roadmap; issues tracked and addressed; feedback quality high,Exemplary feedback culture; stakeholder input drives priorities; issues resolved rapidly; feedback used for continuous improvement
,CD,Skill Gap Closure,Medium,No skill gap analysis; developers in wrong roles; significant capability gaps; no training allocated,Some gaps identified; training occasional; gaps slowly closing,Skill gaps systematically identified and addressed; training allocated; gaps closing at good pace,Proactive skill gap management; targeted development for each developer; gaps eliminated quickly; team versatility high
,CD,Process Improvement Rate,Medium,No process improvements; same bottlenecks recurring; inefficiencies accepted; retrospectives not conducted,Occasional improvements; some bottlenecks addressed; retrospectives informal,Regular retrospectives; process improvements implemented quarterly; bottlenecks systematically eliminated,Continuous improvement culture; weekly process refinements; efficiency gains measurable; team actively suggests improvements
,CD,"Automation & Tooling (CI/CD, Monitoring, Code Generation)",Medium,Manual processes everywhere; no CI/CD; monitoring absent; code generation not used; hours lost to repetition,Basic CI/CD in place; monitoring partial; some automation; manual work remains significant,Strong CI/CD pipeline; comprehensive monitoring; code generation for APIs; automation reducing manual work by 50%+,Advanced automation; sophisticated monitoring and alerting; API SDK generation automated; tools eliminate repetitive work entirely
,CD,Learning Culture,Medium,No learning opportunities; skill development not valued; team stagnating; technical reading discouraged,Some learning encouraged; occasional training; skill development sporadic,Regular learning time; conferences/courses supported; skill development actively encouraged; certifications valued,Exceptional learning culture; continuous education budget generous; team growth prioritized; expertise recognized and rewarded
,LX,Change Adoption Rate,Low,Team resists new tools/frameworks; adoption of new technologies extremely slow; outdated practices entrenched,Some adoption of changes; resistance present; gradual modernization,Team adapts well to changes; new tools adopted reasonably quickly; modernization steady,Exceptional adaptability; team eagerly adopts beneficial changes; rapid modernization; flexibility high
,LX,Resistance Management,Low,Change resistance not addressed; team frustrated with imposed changes; communication poor; trust low,Some resistance acknowledged; communication attempted; buy-in partial,Clear communication about change benefits; team involved in decisions; resistance managed constructively,Exceptional change leadership; team excited about improvements; decisions collaborative; resistance minimal
,LX,Vision Casting for Technical Direction,Low,No vision for backend evolution; technical direction unclear; team confused about goals,Some vision communicated; technical direction emerging; clarity improving,Clear vision for Node.js/PHP evolution; technical roadmap defined; team understands direction,Compelling vision for backend future; technical roadmap inspires team; innovation aligned with vision
,LX,Stability vs. Agility Balance,Low,Either too rigid (no changes) or too unstable (constant breaking changes); API contracts not respected; consuming teams frustrated,Some balance attempted; occasional breaking changes; stability/agility trade-off not always clear,Good balance maintained; breaking changes managed with deprecation periods; stability and agility both achieved,Exemplary balance; rapid development alongside high stability; versioning strategy clear; consuming teams can adopt at own pace
,IO,Team Morale & Energy,Medium,Team morale low; energy drained; frustration evident; negative culture; people seeking other roles,Morale variable; energy inconsistent; some frustration; engagement wavering,Team morale generally positive; energy levels good; team engaged with work; occasional frustrations,Exceptional team spirit; high energy and enthusiasm; positive culture; team proud of work
,IO,Mentorship & Empowerment,Medium,No mentorship; junior developers unsupported; senior developers hoarding knowledge; power imbalance,Some mentorship happening; junior developers receiving some guidance; empowerment partial,Strong mentorship structure; junior developers empowered and growing; senior developers actively mentoring,Exceptional mentorship culture; all developers mentored and empowered; junior-to-senior growth visible; autonomous decision-making
,IO,Vulnerability & Psychological Trust,Medium,Team defensive; mistakes hidden; no psychological safety; trust minimal; people protecting themselves,Some trust building; mistakes occasionally discussed; vulnerability partially accepted,High trust level; team comfortable admitting mistakes; failures discussed openly; psychological safety evident,Exceptional trust; team highly vulnerable with each other; failures treated as learning; blameless culture strong
,IO,Recognition of Potential,Medium,"Potential not recognized; career ceilings imposed; promotions based on tenure, not capability",Some potential recognized; career paths discussed; advancement occasional,Individual potential clearly recognized; career advancement opportunities available; growth encouraged,Exceptional talent development; potential cultivated proactively; high performers visibly advanced; next leaders identified early
,CPS,Innovative Implementation of Solutions,Low,Standard solutions copied without customization; 3rd party integrations poorly implemented; no creative problem-solving,Some innovative approaches; integrations functional but basic; some customization for company needs,Creative solutions for integrations; 3rd party APIs well-customized; innovative approaches to complex problems,Exemplary innovative solutions; elegant integration implementations; creative approaches enabling unique capabilities
,CPS,Blocker Resolution & Creative Problem-Solving,Low,Blockers met with bureaucracy; creative solutions not attempted; 'that's impossible' common; team blocked frequently,Some creative approaches; blockers sometimes overcome; workarounds found occasionally,Proactive blocker resolution; creative problem-solving standard; team finds ways to unblock themselves,Exceptional problem-solving; creative solutions to seemingly impossible problems; team empowered to overcome blockers
,CPS,Culture of Experimentation,Low,Experimentation discouraged; failure not tolerated; only proven approaches used; innovation stifled,Some experimentation encouraged; failure somewhat tolerated; learning from experiments partial,Experimentation supported; small failures accepted as learning; innovations emerging from experiments,Strong experimentation culture; failure celebrated as learning; continuous innovation; experiments shared and built upon
,CPS,Resourceful Orchestration,Low,Resources inadequate; team unable to function effectively; dependencies not managed; external partners poorly coordinated,Resources usually sufficient; some coordination gaps; external partners occasionally difficult to manage,Resources well-managed; dependencies orchestrated effectively; external partners well-coordinated; no preventable delays,Exceptional resource management; proactive orchestration; external partners highly aligned; obstacles eliminated before impact
