,Category,Rating,Priority,1 - Lagging,2 - Developing,3 - Proficient,4 - Exemplary
,FDR,API Delivery Velocity,High,APIs frequently miss SLAs; unpredictable release timelines causing frontend/mobile blockers; deployment velocity significantly below industry benchmarks,APIs released on inconsistent schedules; occasional missed SLAs; delivery velocity trending upward but still behind target,APIs delivered predictably with documented timelines; meets 95%+ SLA commitments; deployment velocity aligns with planning,APIs delivered with exceptional predictability and speed; consistently exceeds SLA targets; rapid iteration enabling quick pivots for consuming teams
,FDR,Delivery Predictability,High,"Sprint commitments are consistently missed; API delivery timelines are unreliable. Backend is the bottleneck for Frontend, Mobile, and Hardware teams who depend on API readiness.",Predictable within a 50-70% margin; frequent scope creep on integration work. Stakeholder teams learn to pad their own timelines to compensate for Backend delays.,"80%+ of committed API endpoints and integrations are delivered on time and as scoped. Downstream teams (Frontend, Mobile, Hardware, GameDev) can plan confidently around Backend delivery dates.",High precision in forecasting; delivery timelines are data-driven using historical velocity from ClickUp. The team of 17 delivers with near-perfect predictability even on complex 3rd party integrations.
,FDR,API Reliability & Uptime,High,API uptime below 95%; frequent error spikes and 5xx responses; reliability issues directly impacting mobile/frontend applications,API uptime 95-98%; occasional error rate anomalies; incident response times extending beyond service windows,API uptime 98-99.5%; error rates consistently below 0.1%; incidents resolved within defined SLAs,API uptime >99.5%; error rates <0.01%; proactive monitoring catches issues before end-user impact; zero unplanned outages
,FDR,Cross-Team Collaboration,High,Poor API documentation; frontend/mobile teams frequently blocked waiting for backend clarification; integration delays common,API specs provided but incomplete; some back-and-forth with consuming teams; occasional integration friction,Clear API contracts documented; responsive to frontend/mobile/hardware needs; effective async collaboration patterns,API-first design philosophy; consuming teams report backend as most collaborative; proactive integration support; design reviews with all stakeholders
,RO,Resource Allocation,High,JS vs PHP team split misaligned with business priorities; 17 developers inefficiently distributed; API/integration work ratios not optimized,Resource allocation partially aligned; some inefficiencies in team sizing; occasional over/under-allocation to API vs integration work,JS and PHP teams appropriately sized for workload; 17 developers allocated strategically; API and integration capacity well-balanced,Optimal allocation driving maximum throughput; proactive rebalancing based on demand; skill-based assignments maximizing efficiency
,RO,Capacity Management,High,No visibility into team capacity; frequent overloads and context switching; 17-person team operating at inconsistent utilization,Basic capacity planning in place; ClickUp used partially for tracking; some visibility but gaps in bottleneck identification,Capacity planned and tracked using ClickUp; 17-person team workload visible and manageable; buffer for incidents maintained,Advanced capacity modeling; predictive load planning; buffer strategically allocated; zero preventable overload situations
,RO,CI/CD & Infrastructure,High,Manual deployment processes; staging environment unreliable; no monitoring/alerting infrastructure; frequent deployment-related incidents,Basic CI/CD in place; staging exists but sometimes unstable; limited monitoring; deployment pain points not systematized,Robust CI/CD pipeline; reliable staging environment; monitoring dashboards deployed; zero-downtime deployments documented,Cutting-edge CI/CD automation; multi-stage testing environments; comprehensive APM/monitoring; canary deployments standard practice
,RO,Cost Efficiency,High,Server costs escalating without ROI; excessive SaaS subscriptions; no cost governance; cloud spend underutilized resources,Cost tracking initiated; some waste identified but not systematically addressed; occasional tool/service audits,Server costs optimized; unused SaaS subscriptions eliminated; infrastructure spending aligned with business growth rate,Best-in-class cost optimization; RI/Reserved capacity strategy reducing spend; proactive vendor negotiations; infrastructure as efficiency driver
,SS,API Documentation & Changelogs,Medium,API documentation missing or severely outdated; no versioning docs; consuming teams confused about endpoints and changes,API documentation exists but incomplete; changelogs sporadic; migration guides missing for breaking changes,API documentation comprehensive and current; clear versioning strategy documented; changelogs updated with each release,API documentation exemplary with examples and SDKs; changelogs detail impact on consuming teams; deprecation timelines clearly communicated
,SS,Expectation Management,Medium,No communication of timeline constraints; consuming teams consistently surprised by delays; SLA misalignment,Occasional communication of constraints; some timeline clarity but reactive rather than proactive,Clear communication of capacity limits and timelines; consuming teams know what to expect; SLAs explicitly documented,Proactive expectation-setting; consuming teams have visibility into 3-month roadmap; realistic commitments consistently met
,SS,Business Vision Alignment,Medium,Team activities misaligned with business direction; backend initiatives not contributing to company strategy,Some alignment with business vision; connection between backend work and strategy sometimes unclear,Team clearly understands business objectives; backend roadmap explicitly linked to company priorities,Backend strategy shapes company capabilities; team proactively identifies technical opportunities enabling business growth
,SS,Feedback Integration,Medium,Feedback from consuming teams ignored; no mechanism for input on API design or integration priorities,Occasional feedback solicited; some input considered but not systematically incorporated,Regular feedback loops with frontend/mobile/hardware teams; design decisions informed by consumer needs,Continuous feedback culture; consuming team input shapes architectural decisions; retrospectives drive iterative improvements
,IRR,Root Cause Analysis,High,Production incidents lack RCA documentation; repeat failures common; server incidents not investigated thoroughly,RCAs attempted but incomplete; sometimes missing database or infrastructure factors; recurring API failures pattern not identified,RCAs consistently documented and thorough; database health and API failure patterns understood; preventive measures implemented,Deep RCA culture with blameless post-mortems; systemic issues identified and resolved; zero repeat incidents
,IRR,Incident Response & Escalation,High,Production outages not escalated promptly; response times excessive; consuming teams blocked for hours without communication,Incident escalation paths exist but inconsistently followed; response times variable; communication gaps during outages,Clear escalation procedures; incidents acknowledged within 15 minutes; status updates every 30 minutes during outages,Incident command system in place; immediate acknowledgment and updates; proactive notification to all consuming teams; outages rare
,IRR,System Health & Technical Debt,High,Database performance degrading; server load management inadequate; legacy PHP code hampering deployments; significant EOL technology,Some server performance issues addressed; database queries occasionally optimized; technical debt inventory partially documented,Database optimized and monitored; server resources right-sized; technical debt tracked in backlog with priority tiers,Exemplary system health; proactive database tuning; server capacity planned ahead of growth; technical debt addressed strategically
,IRR,Testing & Deployment,High,Minimal test coverage; staging unreliable; deployments risky; downtime during releases; zero-downtime deployment not achieved,Basic unit tests present; staging usually works; deployments require manual intervention; occasional downtime during releases,Comprehensive test coverage (unit/integration); staging mirrors production; CI/CD pipeline enforces quality gates; zero-downtime deploys standard,"Advanced testing (load, security, chaos); multi-environment validation; fully automated deployments; canary releases; deployment confidence extremely high"
,DCT,PR Review & Turnaround,High,PR reviews backlogged; turnaround time >2 days; code quality issues slip through; blocking other developers,PR reviews typically responded to within 1 day; some quality gaps; occasionally blocking progress,PR reviews turnaround within 4-8 hours; feedback constructive; quality maintained; minimal developer blocking,PR reviews turnaround within 2 hours; detailed and mentoring-focused feedback; zero developer blocking; quality excellence
,DCT,API Specification Clarity,High,API specs vague or missing; integration requirements unclear; developers uncertain about expected behavior; integration failures common,API specs exist but sometimes incomplete; integration requirements partially documented; some clarification needed,API specs clear and complete; integration requirements well-documented; developers understand edge cases and error handling,API specs exemplary with detailed examples; integration contracts explicitly tested; consumers report maximum clarity
,DCT,Build/Test/Deploy Friction,High,Build process unreliable; test failures frequent; deployment requires manual troubleshooting; high deployment anxiety,Build works most of the time; test suite exists but flaky; deployment manual but documented,Build deterministic and fast; test suite reliable; deployment scriptable and repeatable; high confidence in deployments,Build optimized for speed; test suite comprehensive and blazing fast; fully automated deployments; instant feedback loop
,DCT,Bottleneck Management,High,Multiple blockers not addressed; dependencies unmanaged; integration work stalls other teams; capacity bottlenecks unresolved,Some bottlenecks identified; dependency tracking partial; occasional delays to other teams,Blockers actively managed; dependencies tracked and prioritized; other teams experience minimal delays; capacity constraints communicated,Proactive bottleneck elimination; dependency management seamless; zero team-blocking situations; capacity always aligns with demand
,CDQ,API Architecture & Design Patterns,High,No consistent API design; inconsistent REST/GraphQL usage; microservices vs monolith decisions ad-hoc; SOLID principles not followed,Some architectural patterns followed; inconsistent API design across services; some SOLID principle awareness,Clear API design patterns (REST/GraphQL); appropriate microservices boundaries; SOLID principles consistently applied,Exemplary API architecture; scalable design patterns; clear separation of concerns; architecture reviewed and evolved proactively
,CDQ,Code Documentation & Readability,High,Code poorly commented; API documentation absent; developers spend hours understanding existing code; onboarding difficult,Some code comments present; API docs partially complete; reasonable readability but gaps in complex sections,Code well-commented; API documentation comprehensive; new developers productive within 1 week; maintainability high,Exemplary code clarity; API documentation includes patterns and anti-patterns; self-documenting code; knowledge transfer seamless
,CDQ,PR Review & Mentorship,High,Reviews focus on syntax only; no mentorship occurring; junior developers not growing; code patterns not standardized,Reviews check functionality; some mentorship feedback; junior developers gradually improving,Reviews catch bugs and mentor on patterns; architectural feedback provided; junior developers actively growing; code quality improving,Reviews exemplary mentoring opportunities; architectural guidance; senior developers developing junior talent; code culture continuously elevating
,CDQ,Technical Debt Management,High,No tracking of technical debt; Node packages outdated; PHP legacy code blocking features; database schema hindering performance,Technical debt recognized but not systematized; some modernization efforts; debt accumulating faster than reduction,"Technical debt tracked and prioritized; regular modernization (Node ecosystem, PHP frameworks); debt reduction pace maintained",Technical debt aggressively managed; proactive Node.js version upgrades; PHP modernization strategic; database schema optimized
,TDA,Debt Visibility & Inventory,High,No visibility into technical debt; legacy PHP modules unknown; outdated Node packages untracked; database schema issues not documented,Technical debt partially visible; some legacy systems identified; inventory exists but incomplete,Technical debt systematically tracked; legacy PHP and Node issues documented; database schema debt cataloged with impact,Complete technical debt inventory; clear visibility into legacy systems; dependency vulnerabilities tracked; risk assessment documented
,TDA,Strategic Debt Allocation,High,Debt addressed randomly when it causes failures; no strategic modernization plan; resources not allocated to risk reduction,Some strategic allocation; modernization efforts sporadic; risk reduction not consistently prioritized,Strategic allocation of 15-20% capacity to debt reduction; Node ecosystem modernization planned; PHP legacy deprecation roadmap,Optimized debt reduction strategy; proactive framework/package upgrades; legacy system sunsetting scheduled; debt declining steadily
,TDA,Vulnerability & Risk Mitigation,High,Dependency vulnerabilities not monitored; security patches delayed; EOL frameworks still in use; no risk mitigation process,Vulnerability scanning initiated; patches applied reactively; some EOL framework awareness,Dependency vulnerability scanning automated; security patches applied promptly; EOL framework migration underway,Advanced vulnerability management; zero-day patches deployed within hours; no EOL dependencies; continuous security monitoring
,TDA,Prevention Culture,High,No prevention mechanisms; problematic dependencies adopted without review; architectural decisions cause future debt,Basic dependency review; some architectural consideration; prevention ad-hoc,Dependency review process established; architectural decisions evaluated for long-term sustainability; debt prevention systematic,Prevention-first culture; dependencies vetted thoroughly; architectural review ensures minimal future debt; team proactively educates on debt
,TSD,Mentorship & Growth,Medium,No mentorship structure; junior developers stagnating; skill gaps not addressed; career development ad-hoc,Some informal mentorship; junior developers slowly improving; occasional skill development,Structured mentorship program; junior developers growing rapidly; career paths discussed and supported,Exceptional mentorship culture; junior developers flourishing; career development proactive; next generation leadership emerging
,TSD,Knowledge Sharing Across 17 Developers,Medium,Knowledge siloed in individuals; critical system understanding only in one person; onboarding new developers extremely difficult,Some knowledge sharing; documentation partial; cross-training sporadic; key person dependencies exist,Regular knowledge sharing sessions; documentation comprehensive; cross-training systematic; bus factor >2 on critical systems,Exceptional knowledge distribution; architecture understood by multiple team members; documentation exemplary; no critical dependencies on individuals
,TSD,Tech Stack Evolution,Medium,Node.js versions stale; PHP not modernized; no containerization (Docker) strategy; technology decisions reactive,Node.js updated occasionally; some PHP modernization; Docker exploration underway,Node.js kept current with LTS strategy; PHP modernization roadmap; Docker containerization in place,Leading-edge Node.js practices; PHP modern framework adoption; containerization and orchestration advanced; tech stack intentional
,TSD,Skill Diversity in 17-Person Team,Medium,"Team overly specialized; no cross-skilling between API, integrations, database, DevOps; single points of failure",Some skill diversity; most developers focused on one area; cross-skilling beginning,"Well-distributed skills across API design, integrations, database optimization, and DevOps; team resilient to absences",Exemplary skill diversity; every developer understands full stack; specialists in each domain mentoring peers; rotation prevents silos
,TER,Psychological Safety,Medium,Team afraid to voice concerns; blame culture present; mistakes punished; high stress environment,Some psychological safety; concerns occasionally raised; blame somewhat reduced; stress levels moderate,Safe environment for raising issues; blameless incident culture; team comfortable challenging ideas,Exceptional psychological safety; team proactively shares concerns; blame eliminated; high psychological trust
,TER,Purpose & Impact Connection,Medium,Team unaware how backend work impacts business; API reliability not connected to user experience; no sense of mission,Some connection to business impact; team understands some endpoints matter; occasional purpose conversations,Clear visibility into how backend work impacts customers; team sees API reliability translated to user satisfaction metrics,Deep purposeful connection; team understands every feature's business impact; metrics shared regularly; mission-driven mindset
,TER,Retention & Engagement,Medium,High developer turnover; disengagement evident; developers seeking other roles; team morale low,Moderate turnover; some disengagement; retention initiatives being discussed,Low turnover; team engaged with clear growth opportunities; developers committed to team goals,Exceptional retention; high engagement; developers actively referring peers; team energy and commitment outstanding
,TER,Recognition & Rewards,Medium,Achievements not recognized; no career advancement path; compensation misaligned; frustration evident,Occasional recognition; career paths discussed; compensation reviews periodic; engagement improving,Regular recognition of contributions; clear career advancement opportunities; compensation market-aligned,Exceptional recognition culture; proactive celebration of achievements; compensation top-tier; team feels valued
,KSI,Institutional Memory & Architecture Knowledge,Low,System architecture knowledge in few individuals; critical decisions lost; difficult to explain design choices; no architecture documentation,Some architecture documentation; key decisions partially recorded; knowledge moderately distributed,Architecture thoroughly documented; design decisions explained; knowledge well-distributed across team,Exemplary architectural documentation; decisions with context recorded; knowledge available to entire organization; patterns documented
,KSI,Cross-Division Service Level,Low,"Backend serves consuming teams poorly; Frontend, Mobile, Hardware teams frustrated with API support; response times slow",Service to consuming teams adequate; some responsiveness; occasional delays in addressing integration issues,"Backend consistently responsive to Frontend, Mobile, Hardware team needs; integration support reliable; good relationships",Exceptional service level; consuming teams rate backend highly; proactive support; design collaboration seamless
,KSI,R&D & Experimentation,Low,No space for experimentation; technology decisions solely driven by immediate needs; no learning culture,Occasional experimentation; some room for trying new approaches; learning somewhat encouraged,"Regular time for R&D; experiments with new technologies (Node frameworks, PHP approaches, integration patterns); learning valued",Strong experimentation culture; dedicated R&D time; leading-edge technology exploration; innovations shared with industry
,KSI,Industry Leadership & Thought Leadership,Low,No external visibility; no speaking or thought leadership; not contributing to open source; isolated from industry trends,Occasional conference attendance; some thought leadership interest; minor open source contributions,Team members speak at conferences; writing technical posts; contributing to open source projects; engaged with industry,Recognized industry leaders; significant open source contributions; conference keynotes; influencing backend best practices
,PD,Vision Translation to Team,High,Team unclear on backend vision; no strategic direction communicated; work feels disconnected from company goals,Vision partially communicated; strategic direction emerging but not clearly defined,Clear backend vision articulated; strategic direction understood by team; alignment with company objectives evident,Compelling vision communicated frequently; team deeply understands strategy; alignment clear and visible
,PD,Strategic Initiative Leadership,High,Backend reacts to requests; no proactive strategic initiatives; leadership not driving technology direction,Some strategic thinking; occasional proactive initiatives; leadership partially engaged,Clear strategic initiatives led by backend leadership; technology roadmap defined; initiatives align with business,Exceptional strategic leadership; transformational initiatives driving company capability; backend vision shapes company strategy
,PD,Impact Measurement & Metrics,High,No measurement of API performance impact; uptime metrics not tracked; integration reliability not quantified; impact unclear,"Basic metrics tracked (uptime, response time); impact metrics incomplete; measurement inconsistent","Comprehensive metrics (API latency, error rates, reliability by service, uptime SLA achievement); impact clearly measured",Advanced impact measurement; business metrics correlated with backend performance; ROI of initiatives clearly demonstrated
,PD,Narrative Ownership & Communication,High,Backend story not communicated; leadership doesn't articulate team value; executive visibility minimal,Occasional narrative shared; some executive visibility; story incomplete,Clear narrative of backend team contribution; regular executive updates; impact communicated effectively,Exceptional storytelling; backend vision understood across organization; leadership celebrated; narrative shapes company perception
,RDM,Issue Resolution & Ownership,High,Production issues unresolved; responsibility avoided; long MTTR; consuming teams frustrated,Issues eventually resolved; some ownership; resolution times variable,Issues reliably resolved; clear ownership; MTTR <30 minutes for critical issues; consuming teams confident,Issues immediately resolved; proactive detection; MTTR <5 minutes; zero unresolved escalations
,RDM,Proactive Risk Mitigation,High,Risks ignored until failures occur; no vulnerability scanning; scalability problems not anticipated; database capacity limits not planned,Some risk monitoring; vulnerabilities caught periodically; basic scalability planning,Proactive vulnerability scanning; scalability planned ahead of growth; dependency risks managed; infrastructure capacity sufficient,Advanced risk management; zero-day threat response immediate; scalability planned 6+ months ahead; infrastructure investment strategic
,RDM,Trade-off Transparency,High,Technical trade-offs not explained; decisions seem arbitrary; business impact of technical choices unclear,Trade-offs somewhat explained; reasoning partially transparent; business impact sometimes discussed,Technical trade-offs clearly articulated; business implications explained; stakeholders understand decisions,Exceptional transparency; trade-offs explained with long-term implications; business and technical reasoning clear to all
,RDM,Crisis Ownership & Outage Management,High,Outages cause panic; unclear responsibility; response chaotic; communication poor; recovery slow,Outage responses improving; some chaos; communication gaps; recovery times acceptable,Outages handled with clear command structure; communication timely; recovery systematic; post-mortems conducted,Outage management exemplary; command structure clear; communication frequent; recovery rapid; incidents rare and lessons systematized
,CSF,Stakeholder Communication Clarity,High,Communication unclear; frontend/mobile/hardware teams confused about backend status; messages contradictory,Communication usually clear; occasional confusion; stakeholders understand most updates,"Clear communication to all stakeholders; API status, capacity, and roadmap clearly explained; terminology consistent",Exemplary clarity; all stakeholders understand technical and business aspects; proactive communication prevents confusion
,CSF,Response Timeliness to Blocking Issues,High,Blocking issues ignored; consuming teams stalled for days; response times unacceptable,Blocking issues addressed but slowly; response times variable; occasional team blocking,Blocking issues prioritized and resolved within hours; consuming teams unblocked quickly; SLA clearly defined,Blocking issues immediately triaged; resolution within 2 hours; zero instance of teams blocked by backend
