,Category,Rating,Priority,1 - Lagging,2 - Developing,3 - Proficient,4 - Exemplary
,TDA,Debt Visibility & Inventory,Debt Visibility & Inventory,High,Fails to establish debt visibility; legacy PHP modules unknown; outdated Node packages untracked; database schema issues not documented.,Directs partial debt tracking; some legacy systems identified; inventory exists but incomplete.,Has established systematic technical debt tracking; ensures legacy PHP and Node issues documented; database schema debt cataloged with impact.,Maintains complete technical debt inventory with clear visibility; systematically tracks legacy systems; dependency vulnerabilities monitored; risk assessment documented.
,TDA,Prevention Culture,Prevention Culture,High,Fails to establish prevention mechanisms; problematic dependencies adopted without review; architectural decisions cause future debt.,Directs basic dependency review; some architectural consideration; prevention ad-hoc.,Has established dependency review process; ensures architectural decisions evaluated for long-term sustainability; debt prevention systematic.,Institutes prevention-first culture; dependencies vetted thoroughly; architectural review prevents future debt; proactively educates team on preventing debt.
,TDA,Strategic Debt Allocation,Strategic Debt Allocation,High,Neglects to allocate resources to debt reduction; modernization reactive to failures; no strategic plan for legacy system migration.,Directs some strategic allocation; modernization efforts sporadic; risk reduction not consistently prioritized.,Has allocated 15-20% capacity to strategic debt reduction; ensures Node ecosystem modernization planned; establishes PHP legacy deprecation roadmap.,Optimizes debt reduction strategy with proactive framework/package upgrades; schedules legacy system sunsetting strategically; debt declining steadily.
,TER,Psychological Safety,Psychological Safety,Medium,Fails to establish psychological safety; team afraid to voice concerns; blame culture prevalent; mistakes punished; high stress.,Directs some safety improvements; concerns occasionally raised; blame somewhat reduced; stress levels moderate.,Has established safe environment for raising issues; instituted blameless incident culture; team comfortable challenging ideas.,Institutes exceptional psychological safety; team proactively shares concerns; blame eliminated; high psychological trust foundational.
,TER,Purpose & Impact Connection,Purpose & Impact Connection,Medium,Neglects to connect backend work to business impact; team unaware how APIs affect users; no sense of mission.,Directs some connection to business impact; team understands some endpoints matter; occasional purpose conversations.,Has created clear visibility into customer impact; team sees API reliability translated to user satisfaction metrics.,Directs deep purposeful connection; team understands business impact of every feature; metrics shared regularly; mission-driven mindset prevalent.
,TER,Retention & Engagement,Retention & Engagement,Medium,Fails to manage retention; high turnover evident; team disengaged; developers seeking other roles; morale low.,Directs moderate retention efforts; some disengagement; retention initiatives being discussed.,Has achieved low turnover; team engaged with clear growth opportunities; developers committed to team goals.,Drives exceptional retention; high engagement; developers actively refer peers; team energy and commitment outstanding.
,TSD,Knowledge Sharing Across 17 Developers,Knowledge Sharing Across 17 Developers,Medium,Neglects knowledge distribution; knowledge siloed in individuals; critical system understanding limited to one person; onboarding extremely difficult.,Directs some knowledge sharing; documentation partial; cross-training sporadic; key person dependencies exist.,Has established regular knowledge sharing sessions; ensures comprehensive documentation; implements systematic cross-training; bus factor >2 on critical systems.,Institutes exceptional knowledge distribution; ensures architecture understood by multiple team members; documentation exemplary; no critical dependencies on individuals.
,TSD,Mentorship & Growth,Mentorship & Growth,Medium,Fails to establish mentorship structure; junior developers stagnating; skill gaps unaddressed; career development ad-hoc.,Directs some informal mentorship; junior developers slowly improving; occasional skill development supported.,Has established structured mentorship program; ensures junior developers growing rapidly; career paths discussed and supported.,Institutes exceptional mentorship culture; junior developers flourishing; proactively develops career paths; next-generation leaders emerging from the team.
,TSD,Tech Stack Evolution,Tech Stack Evolution,Medium,Neglects Node.js modernization; PHP outdated; no containerization strategy; technology decisions reactive.,Directs occasional Node.js updates; some PHP modernization; Docker exploration underway.,Has implemented Node.js LTS strategy; established PHP modernization roadmap; implemented Docker containerization.,Drives leading-edge Node.js practices; champions PHP modern framework adoption; implements containerization and orchestration; tech stack intentional and modern.
