#,Category Weights,Rubric Item,Question,Priority,1 - Lagging,2 - Developing,3 - Proficient,4 - Exemplary
1,FDR 100%,"Frontend Delivery Cadence & Predictability","How consistently does the Frontend Head deliver completed features and UI updates on the committed schedule?",High,"Releases frequently miss target dates; delivery predictability is unreliable.","Most releases miss deadlines; sprint velocity is inconsistent.","Releases typically meet committed dates with occasional minor delays.","All features ship on schedule; sprint velocity is predictable and well-forecasted."
2,FDR 60% / CDQ 40%,"UI Quality & Core Web Vitals","How effectively does the team maintain high-quality user interfaces while optimizing Core Web Vitals (LCP, FID, CLS)?",High,"Core Web Vitals scores are poor (red in Lighthouse); UI quality issues block user experience.","Core Web Vitals are inconsistent; some pages meet targets while others lag significantly.","Most Core Web Vitals targets are met; UI quality issues are caught and resolved quickly.","All pages maintain excellent Core Web Vitals scores and UI quality is consistently high."
3,RO 100%,"Team Allocation & Workload Balance","Is the 11-person team allocated effectively with reasonable workload distribution and minimal burnout?",High,"Team is severely overallocated; frequent context-switching; high burnout signals.","Team allocation is uneven; some members are overloaded while others are underutilized.","Workload is generally balanced across the team with occasional spikes handled well.","Team workload is optimally distributed; members have room for growth and reduce burnout."
4,RO 50% / CPS 30% / CD 20%,"Build Tooling & Process Innovation","How well does the team leverage Vite, CI/CD automation, and testing frameworks to improve development velocity?",High,"Build tooling is outdated; CI/CD is manual and slow; tests are minimal or ignored.","Some build optimization efforts underway; CI/CD has gaps; test coverage is inconsistent.","Build tooling is well-configured; CI/CD pipeline is reliable; automated tests provide confidence.","Build tooling is optimized; CI/CD is fast and robust; automated testing enables rapid iteration."
5,SS 100%,"Release Readiness & Gatekeeping","Does the Frontend Head maintain rigorous quality gates before production releases?",High,"Releases go out without proper testing or sign-off; quality is unpredictable.","Release checklist exists but is inconsistently applied; occasional regressions in production.","Release gates are enforced; most issues are caught before production.","Release gates are rigorous; all releases are thoroughly validated before deployment."
6,SS 50% / CSF 50%,"Frontend Status & Reporting to Stakeholders","How clearly and proactively does the Frontend Head communicate team progress, blockers, and status to leadership?",High,"Status is unclear or absent; stakeholders are frequently surprised by delays or issues.","Status updates are irregular; stakeholders sometimes lack clarity on progress.","Weekly status updates are clear and highlight key blockers and progress.","Stakeholders have clear visibility into progress, risks, and upcoming deliverables."
7,IRR 100%,"Incident Response & Root Cause Analysis","How effectively does the team respond to production frontend incidents and prevent recurrence?",High,"Incidents cause extended outages; no post-mortems or preventative measures.","Incidents are addressed eventually; RCA is inconsistent or superficial.","Incidents are resolved quickly; clear RCA identifies root causes.","Incidents are rare; when they occur, RCA is thorough and preventative fixes are implemented."
8,DCT 100%,"Spec Readiness & PR Review Discipline","How rigorously does the team follow specification requirements and maintain code review standards?",High,"PRs are merged without review; specs are ignored; code quality is poor.","PRs sometimes lack review; spec alignment is spotty.","PRs are consistently reviewed and specs are generally followed.","All PRs meet review standards; specs drive implementation; design system adherence is high."
9,DCT 60% / CPS 40%,"Execution Flow & Blocker Removal","How effectively does the Frontend Head identify and remove blockers to keep the team unblocked?",Medium,"Team is frequently blocked on design decisions, backend dependencies, or tooling issues.","Blockers exist for days before resolution; team velocity suffers.","Blockers are typically resolved within a day; team flow is good.","Blockers are identified early and resolved quickly; team flow is seamless."
10,CDQ 100%,"React Architecture & Documentation Standards","How well are React components architected and documented for long-term maintainability?",High,"React patterns are inconsistent; no documentation; technical debt is high.","React code has some patterns; documentation is minimal.","React components follow consistent patterns; documentation covers most components.","React architecture is clean and scalable; documentation is comprehensive and kept current."
11,CDQ 50% / TSD 50%,"Code Review & Peer Mentorship","How effectively does the team conduct peer code reviews and mentor junior developers?",High,"Code reviews are rare or superficial; knowledge stays siloed.","Code reviews happen but lack depth; mentorship is informal.","Code reviews are constructive; junior developers receive regular guidance.","Code reviews drive learning; mentorship is structured and intentional."
12,TDA 100%,"Technical Debt Management","How proactively does the team identify, prioritize, and address technical debt?",Medium,"Technical debt is untracked and growing; it impedes new feature development.","Technical debt exists but is rarely addressed; it accumulates.","Technical debt is tracked and addressed in regular sprints.","Technical debt is actively managed; refactoring is built into sprint planning."
13,TSD 70% / CSF 30%,"Team Knowledge Sharing & Skill Evolution","How well does the team share knowledge and grow their technical capabilities?",High,"Knowledge is siloed; no training or learning opportunities; skills stagnate.","Some knowledge sharing occurs; learning is ad-hoc.","Regular knowledge sharing sessions; team members are upskilling.","Structured learning program; team members mentor each other; skills are continuously evolving."
14,TER 60% / IO 40%,"Psychological Safety & Team Climate","Does the team feel psychologically safe to voice concerns, ask questions, and suggest improvements?",High,"Team is afraid to speak up; feedback is one-way; morale is low.","Some team members hold back; feedback is inconsistent.","Team feels mostly safe; feedback is two-way and constructive.","Team has strong psychological safety; all members actively contribute ideas and feedback."
15,TER 100%,"Retention & Engagement Outcomes","Are team members engaged and staying with the organization?",High,"High turnover; disengagement is evident.","Some turnover; engagement is mixed.","Low turnover; team members are generally engaged.","Team retention is high; engagement scores are strong; team members advocate for the role."
16,KSI 100%,"Frontend Knowledge Capture & Cross-Division Sharing","How effectively is frontend knowledge captured and shared with other teams (Creative Design, Backend)?",Medium,"No cross-team knowledge sharing; frontend expertise is not leveraged.","Occasional cross-team discussions; knowledge is not documented.","Regular knowledge sharing with other teams; some documentation exists.","Frontend team is a trusted knowledge hub; expertise is actively shared and documented."
17,PD 60% / SS 20% / TER 20%,"Vision Translation & Team Purpose","How well does the Frontend Head translate product vision into clear team goals and purpose?",Medium,"Team doesn't understand the vision or strategy.","Vision is vague; team alignment is weak.","Vision is clear; team understands the direction.","Vision is compelling; team is aligned and motivated by the purpose."
18,PD 100%,"Strategic Initiative & Impact Measurement","How effectively does the Frontend Head drive strategic frontend initiatives and measure their impact?",Medium,"No strategic initiatives; impact is unmeasured.","Occasional initiatives launched; impact is unclear.","Strategic initiatives are defined and their impact is measured.","Major initiatives are delivered; clear metrics show business impact."
19,RDM 100%,"Risk-Based Prioritization","Does the Frontend Head prioritize work based on identified risks to performance, accessibility, and user experience?",High,"Work is prioritized randomly; risks are not identified or mitigated.","Some risk awareness; prioritization is sometimes reactive.","Risks are identified and prioritized appropriately.","Risks are systematically identified and prioritized; contingency plans are in place."
20,RDM 60% / CSF 40%,"Trade-off Transparency","How clearly does the Frontend Head articulate trade-offs between speed, quality, scope, and technical debt?",Medium,"Trade-offs are not discussed; decisions are unclear.","Trade-offs are acknowledged but not always transparent.","Trade-offs are clearly discussed before decisions.","Trade-offs are explicitly framed and communicated to stakeholders."
21,CSF 100%,"Responsiveness & Feedback Loops","How quickly and thoroughly does the team incorporate feedback from users and stakeholders?",Medium,"Feedback is rarely collected or acted upon.","Feedback is collected but slow to act upon.","Feedback is regularly incorporated into development.","Feedback loops are tight; user insights drive rapid iteration."
22,CD 100%,"Frontend Automation Maturity","How comprehensive is the team's automated testing coverage (unit, integration, E2E)?",High,"Minimal testing; automation is absent or broken.","Some tests exist; coverage is incomplete.","Good test coverage; automation is reliable.","Comprehensive test coverage (unit, integration, E2E); automation runs fast and reliably."
23,CD 70% / TSD 30%,"Skill Gap Closure","How effectively does the team address skill gaps in React, TypeScript, testing, and accessibility?",High,"Skill gaps are not identified or addressed.","Skill gaps are known but improvements are slow.","Skill gaps are being closed through training and mentorship.","All critical skills are strong; team is proactive in closing emerging gaps."
24,LX 100%,"Change Leadership & Frontend Evolution","How well does the Frontend Head lead the team through technical changes (e.g., Vite, component library updates)?",Medium,"Changes are forced without explanation; team is resistant.","Changes are introduced but adoption is slow and uneven.","Changes are well-planned and adopted with minimal disruption.","Changes are framed compellingly; team embraces evolution and leads improvements."
25,IO 100%,"Empowerment & Autonomy","Do team members have the autonomy to make decisions and take ownership of their work?",High,"Decisions are micromanaged; team has no autonomy.","Team has limited autonomy; approval is often required.","Team members are empowered to make most decisions.","Team members are fully empowered; ownership is distributed and celebrated."
26,CPS 100%,"Culture of Experimentation & Creative Problem Solving","Does the team embrace experimentation and creative approaches to frontend challenges?",Medium,"Team follows existing patterns; no innovation or experimentation.","Occasional experiments; risk-aversion limits creativity.","Team regularly experiments and tries new approaches.","Team proactively experiments; learning from failures is valued and celebrated."
