,Category,Rating,Priority,1 - Lagging,2 - Developing,3 - Proficient,4 - Exemplary
,FDR,Test Velocity & Throughput,High,Test execution is severely backlogged; QA is the bottleneck in every sprint. Test cases pile up and releases are delayed waiting on QA sign-off.,Test cycles complete but often spill past sprint boundaries. The team of 14 is busy but throughput doesn't match capacity; idle time between assignments is common.,Consistent test cycle completion within sprint timelines. Both web and mobile test suites are executed on schedule with clear pass/fail reporting via ClickUp.,"QA throughput exceeds sprint demand; the team proactively pulls in regression and exploratory testing. Automated test suites handle bulk execution, freeing the team for high-value exploratory work."
,FDR,Test Predictability & Planning,High,Test estimates are consistently wrong; scope of testing is unclear until mid-sprint. QA is always scrambling at release time.,"Test plans exist but are loosely scoped; edge cases are frequently missed, causing last-minute test additions that delay releases.",80%+ of planned test cases are executed on time. Test plans are well-scoped with clear entry/exit criteria; coverage is predictable across web and mobile platforms.,Data-driven test estimation using historical defect rates and cycle times. Near-perfect predictability; stakeholders trust QA timelines implicitly.
,FDR,Defect Detection Quality,High,High number of production escapes; critical bugs are found by end-users rather than QA. Bug reports are vague and hard to reproduce.,"Most major bugs are caught pre-release, but edge cases and cross-platform issues (web vs mobile) frequently slip through. Bug reports lack consistent detail.","Strong defect capture rate across both web and mobile applications. Bug reports are detailed with steps to reproduce, severity, platform info, and screenshots/videos.","Near-zero production escapes for critical/major severity. QA acts as the last line of defense with comprehensive cross-platform, cross-browser, and device-specific coverage."
,FDR,Cross-Team Collaboration,Medium,QA operates in a silo; developers are surprised by bug reports. Blame culture between QA and dev teams is common.,QA communicates with dev teams but only reactively — flagging issues late in the cycle. Handoffs between QA and Frontend/Backend/Mobile teams are clunky.,"Active collaboration with all dev teams (Frontend, Backend, Mobile, Hardware, GameDev). QA is embedded in sprint planning and provides early feedback on testability.",QA is a strategic partner across all divisions. Proactively improves the entire company's quality culture; co-designs test strategies with dev leads before development begins.
,RO,Team Allocation & Specialization,High,QA engineers are randomly assigned without regard to platform expertise. Senior testers are doing basic smoke tests while juniors struggle with complex flows.,"Some specialization exists (web vs mobile) but assignments are rigid. When one platform has a surge, the other team can't flex to help.","Clear specialization tracks (web QA, mobile QA) with cross-training. The team of 14 is allocated based on sprint priorities; skill-to-task mapping is deliberate.","Dynamic allocation; QA engineers shift between web and mobile testing seamlessly based on release priority. Specialists mentor generalists, creating a highly flexible team."
,RO,Capacity & Workload Management,High,Burnout is common during release weeks; 2-3 senior testers carry the team. Workload distribution across 14 members is severely uneven.,Workload varies significantly; some testers are overloaded while others wait for builds. Bus factor is concerning — key platform knowledge sits with 1-2 people.,Predictable workload distribution across the team. No single point of failure; at least 2-3 testers can cover any critical test area. On-call rotation for hotfix testing is fair.,Sustainable high performance; proactive load-balancing using ClickUp capacity views. Cross-trained team means any member can cover any area with minimal ramp-up.
,RO,Test Tooling & Infrastructure,High,Testing is entirely manual; no test management tool integration. Device lab is disorganized; testers waste time setting up environments.,Basic test tools are in place but lack integration with CI/CD pipelines. Device coverage is incomplete; some mobile devices and browser versions are untested.,Well-maintained device lab (physical + cloud-based). Test management integrated with ClickUp. Automated regression suites cover core flows for both web and mobile.,"Best-in-class QA infrastructure; comprehensive device farm, parallel test execution, and real-time dashboards showing test coverage, pass rates, and defect trends."
,RO,Cost Efficiency of Quality,Medium,Excessive manual testing hours with diminishing returns. No ROI analysis on testing effort vs defect yield.,Budget is tracked but not optimized; too much time spent on low-risk areas while high-risk areas are under-tested.,Risk-based testing approach ensures effort is concentrated where it matters most. Clear correlation between testing investment and production quality metrics.,High ROI on QA investment; automation reduces manual effort significantly. Metrics prove QA saves more in prevented production incidents than it costs to operate.
,SS,Quality Status Communication,High,Stakeholders are surprised by quality issues at release time. QA status is a black box to project managers and product owners.,QA updates are provided only when asked; reports use technical jargon that stakeholders struggle to interpret.,"Regular, proactive quality status updates. Clear dashboards in ClickUp showing test progress, defect trends, and release readiness across web and mobile.",Radical transparency; stakeholders have real-time access to quality health dashboards. QA provides risk-based release recommendations that stakeholders trust completely.
,SS,Release Readiness & Gatekeeping,High,Over-promises readiness; says 'we're good to go' then critical bugs appear post-release. Or blocks releases indefinitely with no clear exit criteria.,Provides vague readiness assessments; struggles to articulate remaining risk. Release go/no-go decisions feel arbitrary.,"Balanced release gatekeeping; provides clear trade-off analysis (e.g., 'We can release with these 3 known issues — here's the risk and mitigation plan').",Trusted quality advisor; steers release decisions with data-driven confidence levels. Stakeholders rely on QA's judgment for all go/no-go decisions.
,SS,Alignment with Product Vision,Medium,QA tests exactly what's written in specs but misses the user intent. Tests pass but the feature doesn't solve the actual user problem.,Tests cover functional requirements but lack exploratory testing for user experience quality on both web and mobile platforms.,"High degree of user-centric testing; QA validates not just functionality but usability, performance, and cross-platform consistency.",Anticipates quality risks from a user perspective; proactively suggests test scenarios that product owners hadn't considered. QA enhances the product vision.
,SS,Feedback Integration,Medium,Defensive when developers or stakeholders challenge QA findings. Slow to adjust test strategies when requirements change mid-sprint.,Incorporates feedback eventually but with friction. Test plans are rigid and rarely updated based on retrospective insights.,Processes feedback constructively from all stakeholders. Iterates test strategies within the same sprint cycle based on new information.,Feedback loops are closed instantly. QA retrospectives drive measurable process improvements every sprint.
,IRR,Production Defect Root Cause Analysis,High,Production escapes are patched but the same classes of bugs recur. No formal RCA process; QA doesn't learn from misses.,RCAs are performed but focus on blame ('who missed it?') rather than systemic gaps ('why did our process miss it?').,High-quality RCAs for all production escapes. Every missed defect leads to a new test case and a process improvement action item.,Blameless RCA culture. Production escapes trigger automated regression additions and process guardrails that prevent the entire category of bug from recurring.
,IRR,Incident Support & Response,Medium,QA is unavailable during production incidents. No clear role for QA in incident response; testers wait for someone to tell them what to do.,QA responds to incidents but reactively; takes time to reproduce issues and verify fixes. No clear escalation path from QA to dev.,"Clear QA role in incident response; rapid reproduction of issues, verification of hotfixes, and regression testing post-fix. MTTR benefits from QA involvement.",QA maintains production monitoring awareness; identifies patterns in production issues that inform preventive test coverage. QA helps predict incidents before they occur.
,IRR,Test Environment Health,High,Test environments are unstable; significant time wasted on environment-related false failures. Data inconsistency causes unreliable test results.,Test environments work most of the time but periodic instability causes wasted cycles. No clear ownership of environment maintenance.,"Stable, well-maintained test environments for both web and mobile. Environment issues are rare and resolved quickly. Test data is managed and refreshed systematically.",Self-healing test environments with automated provisioning. Environment-related test failures are near-zero. QA owns and continuously improves the test infrastructure.
,IRR,Regression & Release Verification,High,No formal regression process; releases go out with minimal re-testing. Previously fixed bugs frequently reappear.,Basic regression suites exist but are incomplete and manually executed. Regression takes too long and delays releases.,Robust regression test suites for both web and mobile. Automated where possible; manual regression is risk-based and efficient. Release verification is thorough and timely.,"Comprehensive automated regression with intelligent test selection. Only impacted test areas run per release, drastically reducing cycle time while maintaining coverage."
,DCT,Test Case Review & Turnaround,High,Test case creation is slow; large backlogs of untested features. Reviews are rubber-stamps — no real feedback on test quality.,Test cases are created on time but reviews are cursory. Test case quality varies significantly across the team of 14.,Efficient test case creation and peer review process. Reviews improve both test coverage and the reviewing tester's skills. Turnaround is within 24 hours.,Streamlined test design process with templates and reusable components. Peer reviews are strategic — catching coverage gaps before execution begins.
,DCT,Requirement Clarity & Test Readiness,High,Testers frequently stop work to clarify requirements. High re-work rate on test cases due to ambiguous specs.,Requirements are documented but lack edge cases and acceptance criteria specific to testing. QA discovers gaps mid-execution.,'Ready for QA' criteria are well-defined; testers have 90% of what they need upfront including test data requirements and platform-specific acceptance criteria.,Just-in-Time test design; QA is involved in requirement refinement and story grooming. Test scenarios are co-created with developers before coding begins.
,DCT,Execution Friction & Blockers,Medium,"Test execution is frequently blocked by build failures, environment issues, or missing test data. Testers sit idle waiting for resolutions.",Blockers occur regularly but are resolved within a day. Some automation exists but testers still spend significant time on environment setup.,Minimal execution friction; build-to-test handoff is smooth. Blocked tests are flagged immediately in ClickUp and workarounds are applied quickly.,"Near-zero execution friction. Automated build verification, self-service test environments, and intelligent test queuing keep the team productive at all times."
,DCT,Bottleneck Identification & Resolution,Medium,Unaware of where testing bottlenecks exist. Blames 'heavy workload' without data to support it.,Manually tracks blockers; knows bottlenecks exist but lacks data to prove root causes or prioritize fixes.,"Uses cycle time data from ClickUp to identify and fix specific bottleneck stages (e.g., 'test review takes 3x longer than execution').",Proactive bottleneck prevention; uses metrics to predict and preempt slowdowns. Swarming techniques clear critical-path blockers instantly.
,CDQ,Test Design Quality,High,"Test cases are superficial — happy path only. No systematic approach to edge cases, boundary conditions, or negative testing.",Follows basic test design techniques but inconsistently. Some testers write thorough cases; others write minimal checks.,"Consistent application of test design techniques (equivalence partitioning, boundary analysis, state transition) across the team. Both web and mobile test suites are comprehensive.","Advanced test design practices including combinatorial testing, model-based testing, and risk-based prioritization. Test suites are optimized for maximum defect detection with minimum cases."
,CDQ,Test Documentation & Traceability,Medium,No traceability between requirements and test cases. Tribal knowledge is required to understand test coverage.,Basic test documentation exists but is inconsistent. Traceability matrix is incomplete or outdated.,Clear traceability from requirements to test cases to defects. Test documentation is self-explanatory; any QA team member can pick up and execute.,Living test documentation that auto-updates with requirement changes. Full traceability with coverage reports that stakeholders can self-serve.
,CDQ,Review & Mentorship,High,Test reviews are rubber stamps. Junior testers receive no meaningful guidance on improving their craft.,Reviews catch surface-level issues but miss strategic coverage gaps. Mentorship is limited to senior testers occasionally helping juniors.,Rigorous peer reviews that improve both test quality and tester skills. Structured mentorship pairing across the team of 14.,Culture of quality; reviews are seen as strategic alignment opportunities. Senior testers are developing the next generation of QA leaders within the team.
,CDQ,Test Automation Debt,High,No automation; or automation exists but is so brittle and unmaintained that it provides negative value (false failures waste time).,Automation covers some happy paths but maintenance burden is high. Flaky tests erode team confidence in automation.,Healthy automation suite with clear ownership. Flaky test rate is low. Automation covers critical paths for both web and mobile platforms.,Strategic automation roadmap; the team continuously improves automation ROI. Test automation code is reviewed with the same rigor as production code.
,TDA,Test Debt Visibility,Medium,No awareness of testing gaps. No backlog of 'tests we should have but don't.' Coverage blind spots are invisible.,Test debt is acknowledged verbally but not tracked. Known gaps exist but aren't prioritized against new test work.,Clear 'test debt' backlog in ClickUp; gaps are categorized by risk and platform (web vs mobile). Team knows exactly where coverage is thin.,Test debt is quantified with risk scores. Live dashboard shows coverage health across all applications; debt items have clear retirement timelines.
,TDA,Allocation for Debt Reduction,Medium,0% of sprint capacity goes to improving existing test coverage; team only writes tests for new features.,Test debt is only addressed during slow sprints or after a production escape forces action.,"Consistent 15-20% allocation of each sprint to improving existing test coverage, updating stale tests, and expanding automation.",Strategic 'test improvement sprints' are part of the roadmap. The team treats test maintenance as a first-class citizen alongside new feature testing.
,TDA,Risk Mitigation,Medium,High-risk areas of the application have the least test coverage. No awareness of which untested areas pose the greatest production risk.,Reactive approach; only improves coverage for areas that have already caused production incidents.,"Proactively identifies high-risk areas (payment flows, authentication, data sync between web and mobile) and ensures they have the strongest coverage.",Risk heatmap drives all test investment decisions. Zero 'critical' coverage gaps exist; the team retires risk before it manifests.
,TDA,Prevention of New Test Debt,Medium,New features ship without adequate test coverage. 'We'll add tests later' is the norm (and 'later' never comes).,Team knows tests should be comprehensive but leadership pressure to ship fast erodes standards. Definition of Done is loosely enforced.,"Strong Definition of Done requires test coverage before any feature is marked complete. New test debt is the exception, not the rule.",'Leave it better than you found it' culture. Every feature delivery improves overall test coverage. The team proactively refactors test suites alongside new work.
,TSD,Mentorship & Growth,High,No formal 1:1s. Junior QA feel stuck; skill development is entirely self-driven. High turnover among promising testers.,Irregular feedback; growth plans exist on paper but aren't actively followed. Learning happens only when project demands force it.,Structured growth plans for every tester on the team of 14. Regular 1:1s focus on career development. Clear progression path from manual tester to automation/lead roles.,Force multiplier effect; senior QA are actively groomed for leadership. Clear internal promotion path. The team produces future QA leads for the organization.
,TSD,Knowledge Sharing,High,"Tribal knowledge culture; if one tester leaves, critical platform/application knowledge is lost. Onboarding new QA takes months.",Occasional knowledge sharing sessions but documentation is sparse. New team members rely heavily on shadowing.,"Robust internal wiki with platform-specific test guides (web browsers, Android devices, iOS versions). Regular 'show & tell' sessions. Cross-training is standard.",Open knowledge culture; the team maintains living documentation that makes onboarding a new QA engineer fast and self-service. Team contributes to org-wide quality practices.
,TSD,QA Skill Stack Evolution,Medium,"Team relies solely on manual testing. No investment in learning automation, performance testing, or security testing fundamentals.",Some team members are learning automation but only when forced by project needs. No structured upskilling plan.,"Proactive skill gap analysis. Training in automation frameworks, API testing, performance testing is planned and executed. Team skills match the testing demands of 2026.","Future-proofing; the team explores AI-assisted testing, visual regression testing, and other emerging QA practices. The team is 6-12 months ahead of industry trends."
,TSD,Cross-Platform Versatility,High,Rigid silos; web testers can't test mobile and vice versa. The team of 14 operates as two isolated groups.,"Some testers can work across platforms but struggle with the nuances (device-specific behaviors, browser quirks, OS differences).",Most testers are T-shaped: deep expertise in one platform (web or mobile) with working knowledge of the other. Team can flex across platforms during crunch time.,High agility; any tester can cover any platform competently. The team self-organizes based on release priority without supervisor micro-management.
,TER,Psychological Safety,High,Blame culture; testers are afraid to report 'it might be a bug' findings for fear of being wrong. Developers dismiss QA concerns.,People speak up occasionally but usually only confirm bugs when they're 100% certain. Borderline issues go unreported.,"Team feels safe to report uncertain findings, challenge developer pushback, and flag quality concerns without fear of retribution.","High vulnerability leadership; mistakes (missed bugs, false positives) are treated as learning opportunities. Team takes calculated risks in exploratory testing."
,TER,Purpose & Impact,Medium,Team feels like 'gate-checkers'; no understanding of how their quality work impacts end users or the business.,"Aware of company goals but doesn't see how finding bug #4,721 moves the needle.",Clear connection between QA work and user satisfaction. Team understands that their vigilance directly protects the company's reputation and user trust.,"Mission-driven quality culture; the team proactively suggests improvements that align with business outcomes, not just bug counts."
,TER,Retention & Engagement,High,"High regrettable attrition; testers leave due to burnout, boredom (repetitive manual testing), or lack of growth opportunities.",Turnover is average but quiet quitting is visible — testers do the minimum. Low enthusiasm in sprint ceremonies.,"Low attrition; high team engagement. QA engineers stay because of the culture, growth opportunities, and meaningful work across web and mobile platforms.",The QA team is a talent magnet; internal transfers into this team are common. Team members are proud advocates of the QA function.
,TER,Recognition & Rewards,Medium,"Recognition is non-existent or only given when a major production bug is caught last-minute (rewarding firefighting, not prevention).","Generic 'good job' acknowledgments. Preventive quality work (thorough test design, automation investment) goes unnoticed.","Regular, specific recognition. Accomplishments like improved automation coverage, reduced production escapes, and mentorship contributions are celebrated.","Tailored recognition; the supervisor understands what motivates each of the 14 team members (growth, visibility, flexibility) and acts accordingly."
,KSI,QA Knowledge Repository,Medium,"No centralized QA knowledge base. Test strategies, device configurations, and platform-specific gotchas live in individual heads.",Documentation exists in scattered Google Docs but is stale and hard to find. No single source of truth for QA knowledge.,"Well-maintained QA wiki in Google Workspace with platform-specific guides, common defect patterns, and environment setup instructions. Documentation is part of the Definition of Done.",Self-healing knowledge base; documentation is continuously updated. New team members can onboard and be productive within a week using docs alone.
,KSI,Cross-Division Quality Insights,High,QA operates in isolation; quality trends from one product (web vs mobile) don't inform testing strategies for others.,Occasional insights are shared between web and mobile QA tracks but no systematic cross-pollination with dev teams.,"Regular quality trend reports shared with all dev divisions (Frontend, Backend, Mobile, Hardware, GameDev). Defect patterns in one area inform testing in others.",QA is the connective tissue of the organization. Cross-division defect pattern analysis leads to preventive improvements across all teams.
,KSI,QA Innovation & R&D,Medium,Stagnant testing approach; team uses the same methods and tools they used years ago. No experimentation with new testing approaches.,Innovation happens only in crisis; new tools are adopted only when existing ones completely fail to meet needs.,"Dedicated innovation time for exploring new testing tools, AI-assisted testing, visual regression, performance testing approaches. Clear process for evaluating and adopting new methods.",High failure velocity; the team rapidly experiments with and evaluates new QA techniques. 1-2 significant process improvements per quarter come from experimentation.
,KSI,Industry QA Practices,Low,The team only consumes existing internal practices; no awareness of industry QA trends or external best practices.,"Aware of industry trends (shift-left, AI testing, continuous testing) but always 12-18 months behind adoption.",QA practices are current with industry standards. The team actively evaluates external best practices and adopts what fits.,Thought leadership; the QA team's practices are referenced by other divisions. Team members participate in QA communities and bring insights back.
,PD,Vision Translation,Medium,Team sees QA as 'finding bugs' with no connection to business outcomes. 'I'm just running test cases.',Leader mentions quality goals in meetings but it doesn't influence daily testing priorities or team motivation.,"Every test cycle is framed with business context. Team understands why this release matters and what quality means for the user, not just the defect count.","Quality is the north star; the team rejects shortcuts that compromise user experience. QA is seen as a business enabler, not a cost center."
,PD,Strategic Quality Initiative,Medium,Passive; waits for dev teams to tell QA what to test. No proactive quality strategy.,Suggests small testing improvements but waits for permission to implement broader quality initiatives.,"Regularly proposes quality initiatives (e.g., shift-left testing adoption, automated smoke suites, cross-platform test standardization) that solve real business problems.",Proactive intrapreneurship; identifies quality gaps that leadership hadn't seen and proposes solutions that deliver measurable business value.
,PD,Impact Measurement,Medium,Measures success by number of test cases executed or bugs found — vanity metrics that don't reflect quality outcomes.,Tracks test metrics but struggles to quantify how QA prevents business loss or improves user satisfaction.,"Success is defined by business-aligned KPIs: production escape rate, defect detection effectiveness, release confidence score, mean time to detect.",Obsessed with ROI; redirects testing effort away from low-risk areas toward high-impact areas even if it means fewer total test cases.
