,Category,Rating,Priority,1 - Lagging,2 - Developing,3 - Proficient,4 - Exemplary
,PD,Narrative Ownership,Medium,Blames development teams for poor quality or management for unrealistic timelines when releases have quality issues.,Passively accepts the testing scope but doesn't advocate for QA's role in the broader product quality story.,Acts as a bridge; translates quality data into narratives that motivate both the QA team and development partners.,"Culture of radical ownership; the QA team feels co-responsible for product quality, not just responsible for 'finding what developers missed.'"
,RDM,Issue Triage & Prioritization,High,All bugs are treated equally; no severity triage. Critical issues sit alongside cosmetic ones in an undifferentiated backlog.,Basic triage exists but severity assignments are inconsistent. High-priority bugs sometimes wait behind lower-priority ones.,"Disciplined triage process; bugs are categorized by severity, platform impact, and user exposure. Critical/high bugs are fast-tracked with clear SLAs.",Intelligent triage using defect pattern analysis and user impact data. The team anticipates which bugs will have the highest business impact and escalates accordingly.
,RDM,Risk-Based Testing Decisions,High,Tests everything equally; no risk assessment informs testing depth. Time is wasted on low-risk areas while high-risk flows are under-tested.,Identifies high-risk areas but lacks a formal framework for adjusting test depth based on risk. Gut-feeling drives decisions.,Formal risk-based testing approach. Test effort is proportional to risk (likelihood x impact). High-risk flows get exhaustive testing; low-risk areas get smoke coverage.,Predictive risk modeling; uses historical defect data and code change analysis to dynamically adjust testing focus per release.
,RDM,Trade-off Transparency,Medium,Makes invisible quality decisions; team and stakeholders don't know what wasn't tested or what risks remain in a release.,"Explains testing gaps after the fact, usually only when a production issue forces the conversation.",Clearly articulates trade-offs: 'We tested X thoroughly but Y only had smoke coverage due to time constraints — here's the residual risk.',Decision journaling; documents testing trade-offs for every release to build institutional wisdom about risk acceptance.
,RDM,Crisis Ownership,Medium,Deflects blame when production escapes occur; points fingers at developers or unclear requirements.,Takes responsibility after investigation but is defensive during the initial heat of a production incident.,"The buck stops here; provides calm, data-driven assessment during production incidents and takes ownership of the QA gap that allowed the escape.",Radical accountability; uses production escapes as catalysts to overhaul testing processes and prevent entire categories of future escapes.
,CSF,Quality Reporting Clarity,High,Communication is too technical or too late. Stakeholders are confused by defect density charts and don't know if the release is safe.,Reports are sent regularly but lack 'so what?' insights. Stakeholders still have to ask 'are we safe to release?',"Proactive, audience-appropriate quality reporting. Translates test results into business language: risk level, confidence score, and recommended actions.",Executive-level quality narrative. Stakeholders don't just get updates; they get strategic quality insights that inform business decisions.
,CSF,Response Timeliness,Medium,Radio silence during critical test phases. Developers and PMs wait in the dark for QA results or bug confirmations.,Responds when asked but rarely proactively flags emerging quality concerns. Dev teams are surprised by late bug reports.,Predictable communication cadence. Blockers and quality concerns are flagged in ClickUp before they impact release timelines.,Instant transparency; automated test result notifications and quality dashboards keep all stakeholders informed in real-time.
,CSF,Internal QA Knowledge Sharing,Medium,Information hoarding; test strategies and platform-specific knowledge stay in a few testers' heads. Team reinvents the wheel constantly.,Documentation exists but is unorganized. The Google Workspace has scattered docs with no clear structure or ownership.,Documentation is a Definition of Done for QA. Active knowledge base maintenance. Regular internal demos and cross-platform learning sessions.,Living documentation culture. The team enjoys sharing knowledge. QA playbooks are self-explanatory and continuously improved.
,CSF,Feedback Loop Quality,Medium,Defensive when developers challenge bug validity. Stakeholder feedback about QA process is dismissed or ignored.,"Takes feedback but acts on it slowly. Developer-QA feedback is a one-way street (QA reports bugs, devs push back, nothing improves).","Actively solicits feedback from developers, PMs, and stakeholders. QA retrospectives drive real improvements to the testing process.",Radical candor. Creates a space where developers and QA collaborate on quality rather than operating as adversaries. Stakeholder voice is reflected in QA strategy.
,CD,Skill Gap Closure,High,Reactive; only addresses skill gaps after a major quality miss. Relies on hiring to fill capability gaps rather than developing existing team.,Identifies gaps but lacks structured training. QA skills are learned on the fly under sprint pressure.,"Regular skill audits for all 14 team members. Clear upskilling paths: manual to automation, functional to performance/security testing. Training tied to 12-month roadmap.","Future-proofing; anticipates industry shifts (AI-assisted testing, codeless automation, shift-left practices) and builds team capability before the business needs it."
,CD,Process Improvement Rate,Medium,'We've always tested it this way.' QA workflows are rigid; retrospective feedback is ignored.,Improvements are sporadic patches to fix immediate pain points rather than systemic upgrades to the QA process.,"Regular workflow audits via retrospectives. At least one meaningful process improvement per month: faster test cycles, better defect triage, improved automation coverage.",Self-optimizing QA system. Constant experimentation with tools and methods results in measurable quality and efficiency gains quarter over quarter.
,CD,Test Automation Maturity,High,Heavy reliance on manual testing for everything. No automation strategy; all 14 testers execute tests by hand.,"Basic automation exists but is fragile, poorly maintained, and covers only a fraction of critical paths. Viewed as 'nice to have.'",Active automation strategy. Manual toil is progressively replaced with reliable automated checks. Automation covers critical regression for both web and mobile platforms.,"Hyper-automation. AI-assisted test generation, intelligent test selection, and self-healing test scripts. The team focuses on exploratory and strategic testing while automation handles regression."
,CD,Learning Culture,Medium,No time allocated for learning. QA team members who want to learn new testing techniques must do so on their own time.,"Encourages learning in theory but sprint pressure always wins. No budget or time allocated for courses, certifications, or conferences.","Dedicated learning time (e.g., 10% of sprint capacity). Team actively shares course completions, certifications, and testing technique discoveries.",Thought leadership culture. The QA team is a learning machine. Knowledge sharing is systematic and the team contributes to the broader QA community.
,LX,Change Adoption Rate,Medium,Team actively resists new processes or tools; shadow work (doing it the old way) is common among the 14 members.,Adoption is slow and forced; testers comply only when the supervisor is watching. New tools are used minimally.,"80%+ of the team adopts new workflows within the target timeframe. Changes to QA process are embraced, not just tolerated.",Rapid viral adoption. The team doesn't just adopt changes; they improve upon them. QA process innovations spread to other teams.
,LX,Resistance Management,Medium,Dismissive of concerns; 'just do it' approach. Team frustration builds silently.,Listens to concerns but lacks a plan to address them. Resistance lingers and slows down improvements.,Proactively identifies resistors among the 14 team members. Holds open forums to address fears and clarify the 'why' behind QA process changes.,Psychological safety around change. Resistance is treated as valuable feedback. Skeptics are converted into change champions.
,LX,Vision for QA Evolution,Medium,Communicates changes via impersonal messages; no context or vision for where QA is headed.,Explains changes but fails to show 'what's in it for the team' — how new tools or processes will make their work better.,"Connects QA changes to both business goals and team benefits (e.g., 'This automation framework will eliminate repetitive regression work and free you for exploratory testing').","Master storytelling. Creates a compelling vision for the QA function's future that makes evolution feel exciting, not threatening."
,LX,Stability vs. Agility,Low,"Change is chaotic; the team of 14 feels whiplashed by frequent, uncoordinated shifts in testing approach or tooling.",Changes are structured but frequent enough to cause fatigue. Testers can't build mastery before the next change arrives.,Balances necessary evolution with stability anchors. Core QA processes remain constant while specific tools and techniques evolve.,"High-frequency agility. The team is so well-practiced in adapting that process changes feel like minor course corrections, not disruptions."
,IO,Team Morale & Energy,High,Low energy; clock-in/clock-out culture across the team of 14. QA is seen as the 'boring' part of software development.,Functional morale; the team does the work but lacks excitement or pride in the QA craft.,"High engagement; team celebrates quality wins together (zero production escapes, successful releases, automation milestones). Strong team identity.",Contagious enthusiasm. The QA division has a distinct positive energy. High resilience — the team stays motivated even during high-pressure release cycles.
,IO,Mentorship & Empowerment,High,Gatekeeping; supervisor makes all testing decisions and assigns all work. No autonomy for the team.,Mentorship is ad-hoc; only top performers get attention. Development of the 14 members is a checkbox exercise.,"Structured mentorship at all levels. Delegates real authority — senior testers own test strategy for their platform, not just task execution.",Talent incubator. The supervisor is known for developing strong QA professionals. Team members are promoted to leadership roles across the organization.
,IO,Vulnerability & Trust,Medium,Never admits when QA misses something. Team feels they must be 'perfect' to avoid blame.,Shares minor issues but maintains a controlling facade. Team hesitates to flag potential false positives or uncertain findings.,Admits when QA processes fail. Builds trust through honesty. Team feels safe reporting ambiguous findings without fear of looking incompetent.,"Radical authenticity. Leads with vulnerability, creating a space where the team takes calculated risks in exploratory testing and speaks up about systemic issues."
,IO,Recognition of Potential,Medium,Sees testers only for their current role; pigeonholes manual testers as 'manual-only' and automation testers as 'just scripters.',"Recognizes hard work but doesn't actively stretch people into new domains (e.g., manual tester interested in automation, tester interested in DevOps).","Identifies hidden gems and provides stretch assignments. Helps manual testers transition to automation, testers interested in leadership get project ownership.",Pathfinder leadership. Sees potential in team members they don't see in themselves. Creates growth opportunities that transform career trajectories.
,CPS,Innovative Testing Approaches,Medium,Follows the same testing playbook even when it's clearly missing bugs. No experimentation with new approaches.,Tries new testing techniques only when existing ones completely fail. Innovation is reactive and rare.,"Actively encourages safe-to-fail experiments. Regularly implements creative testing approaches (chaos testing, AI-generated test data, crowd-sourced testing for edge cases).",Transformative innovation. Creates testing approaches that catch categories of bugs the team didn't know existed. QA methodology becomes a competitive advantage.
,CPS,Blocker Resolution,Medium,Escalates testing blockers immediately without attempting to find workarounds. Test cycles stall at the first sign of friction.,Resolves blockers linearly (brute force). Solutions involve 'just wait for the fix' rather than creative workarounds.,"High efficiency in finding workarounds. Can re-prioritize test execution, use mocks, or shift test focus to keep the team productive when blockers arise.","Obstacle transmutation. Uses testing blockers as catalysts to redesign the build-to-test handoff process, permanently removing friction for the whole organization."
,CPS,Culture of Experimentation,Low,Punishes 'creative' testing. Team is afraid to go off-script from documented test cases for fear of wasting time.,Allows exploratory testing in theory but doesn't allocate time or reward insights from it. Experimentation happens 'off the clock.',Allocates dedicated time for exploratory testing and tool experimentation. Celebrates discoveries — both bugs found and process insights gained.,"Institutionalized curiosity. The QA team is a laboratory for testing innovation. Creative approaches are part of the culture, not an exception."
,CPS,Resourceful Orchestration,Medium,Requests more headcount as the only solution to testing capacity issues. Can't see how to do more with the existing team of 14.,Uses existing resources but struggles when multiple releases compete for QA time. Defaults to overtime.,"Does more with less. Finds creative ways to use automation, risk-based testing, and cross-training to handle peak loads without burnout.",Mastery of constraints. Solves QA capacity challenges by simplifying test strategies and leveraging the full breadth of 14 team members' combined skills.
